{
  "schema_version": 1,
  "profile": "gov",
  "title": "건축 인허가 신청·협의·허가·착공",
  "subtitle": "사전 상담부터 착공 신고와 사후 관리까지 10단계 업무 경로",
  "lanes": ["신청인", "접수·민원실", "건축과", "협의 부서", "허가권자"],
  "stages": [
    "G0 사전 상담",
    "G1 신청·접수",
    "G2 형식 검토",
    "G3 보완 요청",
    "G4 부서 협의",
    "G5 심의",
    "G6 허가 결정",
    "G7 통지·납부",
    "G8 착공 신고",
    "G9 사후 관리"
  ],
  "nodes": [
    { "id": "B01", "lane": "신청인", "stage": "G0 사전 상담", "label": "사전 상담 신청 및 대지 조건 확인", "emphasis": "lead", "refs": [{ "source": "건축법 제10조" }] },
    { "id": "B02", "lane": "건축과", "stage": "G0 사전 상담", "label": "사전 결정 안내", "emphasis": "normal" },
    { "id": "B03", "lane": "신청인", "stage": "G1 신청·접수", "label": "건축허가 신청서 제출", "emphasis": "key", "refs": [{ "source": "건축법 제11조" }] },
    { "id": "B04", "lane": "접수·민원실", "stage": "G1 신청·접수", "label": "접수·등록 및 수수료 확인", "emphasis": "normal" },
    { "id": "B05", "lane": "건축과", "stage": "G2 형식 검토", "label": "서류 형식·기재사항 검토", "emphasis": "key" },
    { "id": "B06", "lane": "신청인", "stage": "G3 보완 요청", "label": "보완 자료 제출", "emphasis": "loop", "note": "보완 요청 시 재제출" },
    { "id": "B07", "lane": "건축과", "stage": "G3 보완 요청", "label": "보완 요구 통지", "emphasis": "bottleneck", "note": "보완 기간 동안 처리 정지" },
    { "id": "B08", "lane": "협의 부서", "stage": "G4 부서 협의", "label": "소방·도로·환경 협의", "emphasis": "key", "refs": [{ "source": "건축법 제12조" }] },
    { "id": "B09", "lane": "건축과", "stage": "G4 부서 협의", "label": "협의 결과 취합", "emphasis": "normal" },
    { "id": "B10", "lane": "협의 부서", "stage": "G5 심의", "label": "건축위원회 심의", "emphasis": "bottleneck", "note": "심의 일정에 따라 지연 가능" },
    { "id": "B11", "lane": "허가권자", "stage": "G6 허가 결정", "label": "허가 여부 결정", "emphasis": "key", "refs": [{ "source": "건축법 제11조제1항" }] },
    { "id": "B12", "lane": "허가권자", "stage": "G6 허가 결정", "label": "불허가 사유 통지", "emphasis": "normal" },
    { "id": "B13", "lane": "접수·민원실", "stage": "G7 통지·납부", "label": "허가서 교부 및 면허세 납부 안내", "emphasis": "normal" },
    { "id": "B14", "lane": "신청인", "stage": "G7 통지·납부", "label": "면허세·채권 납부", "emphasis": "normal" },
    { "id": "B15", "lane": "신청인", "stage": "G8 착공 신고", "label": "착공 신고서 제출", "emphasis": "lead", "refs": [{ "source": "건축법 제21조" }] },
    { "id": "B16", "lane": "건축과", "stage": "G8 착공 신고", "label": "착공 신고 수리", "emphasis": "normal" },
    { "id": "B17", "lane": "건축과", "stage": "G9 사후 관리", "label": "공사 감리·중간 검사", "emphasis": "normal" },
    { "id": "B18", "lane": "신청인", "stage": "G9 사후 관리", "label": "변경 허가 신청", "emphasis": "loop", "note": "설계 변경 시 재신청" }
  ],
  "edges": [
    { "id": "E01", "source": "B01", "target": "B02", "type": "message", "label": "상담 요청" },
    { "id": "E02", "source": "B02", "target": "B03", "type": "sequence" },
    { "id": "E03", "source": "B03", "target": "B04", "type": "sequence" },
    { "id": "E04", "source": "B04", "target": "B05", "type": "sequence" },
    { "id": "E05", "source": "B05", "target": "B07", "type": "sequence", "label": "미비" },
    { "id": "E06", "source": "B07", "target": "B06", "type": "loop", "label": "보완 요구" },
    { "id": "E07", "source": "B06", "target": "B05", "type": "sequence", "label": "재검토" },
    { "id": "E08", "source": "B05", "target": "B08", "type": "sequence", "label": "적합" },
    { "id": "E09", "source": "B08", "target": "B09", "type": "message", "label": "협의 의견" },
    { "id": "E10", "source": "B09", "target": "B10", "type": "sequence" },
    { "id": "E11", "source": "B10", "target": "B11", "type": "sequence", "label": "심의 결과" },
    { "id": "E12", "source": "B11", "target": "B12", "type": "sequence", "label": "불허가" },
    { "id": "E13", "source": "B11", "target": "B13", "type": "sequence", "label": "허가" },
    { "id": "E14", "source": "B13", "target": "B14", "type": "message", "label": "납부 안내" },
    { "id": "E15", "source": "B14", "target": "B15", "type": "sequence" },
    { "id": "E16", "source": "B15", "target": "B16", "type": "sequence" },
    { "id": "E17", "source": "B16", "target": "B17", "type": "sequence" },
    { "id": "E18", "source": "B17", "target": "B18", "type": "loop", "label": "설계 변경" },
    { "id": "E19", "source": "B18", "target": "B03", "type": "loop", "label": "변경 허가 재신청" }
  ]
}
